{"schema_status":"provisional-m2-json-compatible-yaml","unit_id":"unit-01","title":"fixture","curriculum_map_ref":"curriculum/curriculum-map.yml#unit-01","content_status":"specification-only-no-textbook-content","subunits":[{"subunit_id":"unit-01a","title":"fixture","observable_objectives":["構造検査"],"prerequisite_skills":[],"new_skills":["orth.fixture.recognize"],"review_skills":[],"lexical_conditions":{"categories":[],"candidate_lemmas":[],"limit":0,"status":"fixture"},"allowed_sentence_structures":["isolated-word"],"forbidden_or_unlearned_structures":[],"planned_explanation_topics":[],"planned_practice_formats":[],"cumulative_reading_contribution":"fixture","exit_criteria":["構造検査"],"human_review_required":["fixture"],"evidence_refs":["design:DEC-0011"],"provisional_approval":{"draft":true,"source_checked":false,"editorial_approved":false,"expert_reviewed":false}}],"unit_human_gate":["fixture"],"review":{"source_checked":false,"editorial_approved":false,"expert_reviewed":false}}
